[
  {
    "message_id": "msg-user-plain-0001",
    "role": "user",
    "content": "Summarize the onboarding checklist.",
    "ts": "2026-07-01T18:00:00Z"
  },
  {
    "message_id": "msg-user-image-0002",
    "role": "user",
    "content": [
      {
        "type": "text",
        "text": "Please inspect this diagram."
      },
      {
        "type": "image",
        "attachment_id": "att-architecture-diagram",
        "mime_type": "image/png",
        "alt_text": "Architecture diagram upload"
      }
    ],
    "attachments": [
      {
        "attachment_id": "att-architecture-diagram",
        "filename": "architecture.png",
        "mime_type": "image/png",
        "size_bytes": 4096,
        "storage_ref": {
          "bucket": "memory-resources",
          "path": "prj-platform/resources/architecture.png",
          "sha256": "cccccccccccccccccccccccccccccccccccccccccccccccccccccccccccccccc"
        },
        "content_hash": "dddddddddddddddddddddddddddddddddddddddddddddddddddddddddddddddd",
        "resource_id": "res-architecture-001"
      }
    ],
    "ts": "2026-07-01T18:00:01Z"
  },
  {
    "message_id": "msg-user-redacted-0003",
    "role": "user",
    "content": "Patient {_{patient_name}_} reported symptoms in the attached intake form.",
    "attachments": [
      {
        "attachment_id": "att-intake-form",
        "filename": "intake.pdf",
        "mime_type": "application/pdf",
        "size_bytes": 8192,
        "storage_ref": {
          "bucket": "memory-resources",
          "path": "prj-health/resources/intake.pdf",
          "sha256": "eeeeeeeeeeeeeeeeeeeeeeeeeeeeeeeeeeeeeeeeeeeeeeeeeeeeeeeeeeeeeeee"
        },
        "content_hash": "ffffffffffffffffffffffffffffffffffffffffffffffffffffffffffffffff",
        "resource_id": "res-intake-001"
      }
    ],
    "redaction": {
      "pii_whitelist": {
        "entries": [
          {
            "entity_type": "location",
            "justification": "City-only location is allowed for routing."
          },
          {
            "value": "support@maivn.io",
            "justification": "Public support address stays visible."
          }
        ],
        "phi_mode": true
      },
      "known_pii_values": [
        "Maria Santos",
        {
          "value": "1985-07-14",
          "name": "patient_dob",
          "pii_type": "date",
          "label": "Patient DOB",
          "description": "Date of birth from intake form.",
          "format": "date"
        }
      ],
      "private_data_schema": [
        "patient_name",
        "patient_dob"
      ]
    },
    "metadata": {
      "case_id": "case-1001"
    },
    "ts": "2026-07-01T18:00:02Z"
  },
  {
    "message_id": "msg-assistant-0004",
    "role": "assistant",
    "content": "The onboarding checklist is ready for review.",
    "ts": "2026-07-01T18:00:03Z"
  },
  {
    "message_id": "msg-tool-0005",
    "role": "tool",
    "content": "lookup_case returned priority=high",
    "metadata": {
      "tool_call_id": "call-lookup-001",
      "tool_name": "lookup_case"
    },
    "ts": "2026-07-01T18:00:04Z"
  },
  {
    "message_id": "msg-assistant-artifact-0006",
    "role": "assistant",
    "content": "The private image is available in your vault.",
    "artifact_refs": [
      {
        "artifact_id": "art-private-image-0006",
        "logical_output_id": "out-private-image-0006",
        "revision": 1,
        "kind": "image",
        "mime_type": "image/png",
        "custody": "vault_private",
        "state": "available_in_vault",
        "created_at": "2026-08-09T00:01:00Z",
        "effective_retention": {
          "policy_snapshot_id": "policy-private-image-0006",
          "retention_class": "vault_private",
          "expires_at": "2026-09-08T00:01:00Z"
        },
        "producer": {
          "producer_class": "vault",
          "producer_id": "producer-private-image-0006",
          "root_invocation_id": "invocation-support-001"
        },
        "display_label": "Private image",
        "creation_receipt_id": "receipt-private-image-0006",
        "retrieval_action": {
          "relation": "artifact.vault_download_authorization"
        }
      }
    ],
    "ts": "2026-08-09T00:01:00Z"
  }
]
